{
  "schema_version": "image79-play-log-v1",
  "candidate": {
    "issue": 125,
    "commit_sha": "3b73278e5a04a408b8c8aed9422393606eed34e2",
    "window_id": "options"
  },
  "required_controls": [
    "options.minimize",
    "options.close",
    "options.bgm",
    "options.effect",
    "options.bgm_on",
    "options.effect_on",
    "options.attack",
    "options.skill",
    "options.item",
    "options.option",
    "options.skin"
  ],
  "required_actions": [
    {
      "control_id": "options.minimize",
      "gesture": "Activate",
      "window_action": "ToggleMinimized"
    },
    {
      "control_id": "options.close",
      "gesture": "Activate",
      "window_action": "CloseWindow"
    },
    {
      "control_id": "options.bgm",
      "gesture": "Activate",
      "window_action": "StepRange"
    },
    {
      "control_id": "options.bgm",
      "gesture": "Drag",
      "window_action": "SetRange"
    },
    {
      "control_id": "options.bgm",
      "gesture": "Wheel",
      "window_action": "StepRange"
    },
    {
      "control_id": "options.effect",
      "gesture": "Activate",
      "window_action": "StepRange"
    },
    {
      "control_id": "options.effect",
      "gesture": "Drag",
      "window_action": "SetRange"
    },
    {
      "control_id": "options.effect",
      "gesture": "Wheel",
      "window_action": "StepRange"
    },
    {
      "control_id": "options.bgm_on",
      "gesture": "Activate",
      "window_action": "ToggleValue"
    },
    {
      "control_id": "options.effect_on",
      "gesture": "Activate",
      "window_action": "ToggleValue"
    },
    {
      "control_id": "options.attack",
      "gesture": "Activate",
      "window_action": "ToggleValue"
    },
    {
      "control_id": "options.skill",
      "gesture": "Activate",
      "window_action": "ToggleValue"
    },
    {
      "control_id": "options.item",
      "gesture": "Activate",
      "window_action": "ToggleValue"
    },
    {
      "control_id": "options.option",
      "gesture": "Activate",
      "window_action": "ToggleValue"
    },
    {
      "control_id": "options.skin",
      "gesture": "Activate",
      "window_action": "ToggleDropdown"
    },
    {
      "control_id": "options.skin",
      "gesture": "Activate",
      "window_action": "SelectChoice"
    },
    {
      "control_id": "options.skin",
      "gesture": "KeyCommand",
      "window_action": "DismissDropdown"
    }
  ],
  "console_errors": [],
  "actions": [
    {
      "control_id": "options.bgm",
      "gesture": "Activate",
      "window_action": "StepRange",
      "expected": "arrow steps the Range and exposes pressed state",
      "observed": "86.7299 -> 84.7299",
      "responsive": true,
      "matches_expected": true,
      "assertions": {
        "pressed_exposed": true,
        "stepped": true
      },
      "frames": {
        "before": {
          "path": "01-options-bgm-activate-before.png",
          "sha256": "8ae817197ef6e4faa4dc3313d4c52893ee6a165df1be77b0f570ef3817be93e4"
        },
        "after": {
          "path": "01-options-bgm-activate-after.png",
          "sha256": "e7dec7e922ded9ebed5f14cee61720c78bcca8cd27a37874526ecdd0686048f2"
        }
      }
    },
    {
      "control_id": "options.bgm",
      "gesture": "Wheel",
      "window_action": "StepRange",
      "expected": "wheel input steps and clamps the Range",
      "observed": "84.7299 -> 85.7299",
      "responsive": true,
      "matches_expected": true,
      "assertions": {
        "wheel_stepped": true
      },
      "frames": {
        "before": {
          "path": "02-options-bgm-wheel-before.png",
          "sha256": "e7dec7e922ded9ebed5f14cee61720c78bcca8cd27a37874526ecdd0686048f2"
        },
        "after": {
          "path": "02-options-bgm-wheel-after.png",
          "sha256": "dc853d4f2f97e4f5418b465fcf6852ae18aca5cf86555efe3b50fb1a21827781"
        }
      }
    },
    {
      "control_id": "options.bgm",
      "gesture": "Drag",
      "window_action": "SetRange",
      "expected": "31-frame continuous drag reaches a clamped endpoint",
      "observed": "85.7299 -> 0 across 31 samples",
      "responsive": true,
      "matches_expected": true,
      "assertions": {
        "continuous": true,
        "monotonic": true,
        "endpoint_clamped": true
      },
      "frames": {
        "before": {
          "path": "03-options-bgm-drag-before.png",
          "sha256": "dc853d4f2f97e4f5418b465fcf6852ae18aca5cf86555efe3b50fb1a21827781"
        },
        "mid": {
          "path": "03-options-bgm-drag-mid.png",
          "sha256": "dc64a83f5c9ce5d413afb4b6eee10750da72de3910ee20c259686d3b4ee7e04f"
        },
        "after": {
          "path": "03-options-bgm-drag-after.png",
          "sha256": "99d172505116dabef9d7688b00a20cfd9c6437670b57dc69543a34a1bad20438"
        }
      },
      "motion_samples": [
        85.7299220619019,
        82.8722502055921,
        80.0145783492823,
        77.1569064929725,
        74.2992346366627,
        71.4415627803529,
        68.5838909240431,
        65.7262774745813,
        62.8686056182715,
        60.0109337619617,
        57.1532619056519,
        54.2955900493421,
        51.4379181930323,
        48.5803047435706,
        45.7226328872608,
        42.864961030951,
        40.0072891746411,
        37.1496173183313,
        34.2919454620215,
        31.4342736057117,
        28.57666015625,
        25.7189882999402,
        22.8613164436304,
        20.0036445873206,
        17.1459727310108,
        14.288300874701,
        11.4306290183911,
        8.57301556892943,
        5.71534371261962,
        2.85767185630981,
        0
      ]
    },
    {
      "control_id": "options.bgm",
      "gesture": "Drag",
      "window_action": "SetRange",
      "expected": "31-frame continuous drag reaches a clamped endpoint",
      "observed": "0 -> 100 across 31 samples",
      "responsive": true,
      "matches_expected": true,
      "assertions": {
        "continuous": true,
        "monotonic": true,
        "endpoint_clamped": true
      },
      "frames": {
        "before": {
          "path": "04-options-bgm-drag-before.png",
          "sha256": "99d172505116dabef9d7688b00a20cfd9c6437670b57dc69543a34a1bad20438"
        },
        "mid": {
          "path": "04-options-bgm-drag-mid.png",
          "sha256": "ddac30b48a7ff00d5d7d4d016573d33bcd5c05147c71bd0fbdc301f43e022e50"
        },
        "after": {
          "path": "04-options-bgm-drag-after.png",
          "sha256": "ab37dc5bd13e2cb322bf458adc952655150de228aee4d34998de152bd6618f02"
        }
      },
      "motion_samples": [
        0,
        3.33333722712321,
        6.66667445424641,
        10.0000116813696,
        13.3333489084928,
        16.666686135616,
        20.0000233627392,
        23.3333605898624,
        26.6666394101376,
        29.9999766372608,
        33.333313864384,
        36.6666510915072,
        39.9999883186304,
        43.3333255457536,
        46.6666627728768,
        50,
        53.3333372271232,
        56.6666744542464,
        60.0000116813696,
        63.3333489084928,
        66.666686135616,
        70.0000233627392,
        73.3333605898624,
        76.6666394101376,
        79.9999766372608,
        83.333313864384,
        86.6666510915072,
        89.9999883186304,
        93.3333255457536,
        96.6666627728768,
        100
      ]
    },
    {
      "control_id": "options.effect",
      "gesture": "Activate",
      "window_action": "StepRange",
      "expected": "arrow steps the Range and exposes pressed state",
      "observed": "52.1327 -> 54.1327",
      "responsive": true,
      "matches_expected": true,
      "assertions": {
        "pressed_exposed": true,
        "stepped": true
      },
      "frames": {
        "before": {
          "path": "05-options-effect-activate-before.png",
          "sha256": "ab37dc5bd13e2cb322bf458adc952655150de228aee4d34998de152bd6618f02"
        },
        "after": {
          "path": "05-options-effect-activate-after.png",
          "sha256": "33050d36e8a5401cdf07e26863f8ebe1fe3a424e21524d3c992ed657eddb189b"
        }
      }
    },
    {
      "control_id": "options.effect",
      "gesture": "Wheel",
      "window_action": "StepRange",
      "expected": "wheel input steps and clamps the Range",
      "observed": "54.1327 -> 55.1327",
      "responsive": true,
      "matches_expected": true,
      "assertions": {
        "wheel_stepped": true
      },
      "frames": {
        "before": {
          "path": "06-options-effect-wheel-before.png",
          "sha256": "33050d36e8a5401cdf07e26863f8ebe1fe3a424e21524d3c992ed657eddb189b"
        },
        "after": {
          "path": "06-options-effect-wheel-after.png",
          "sha256": "54f1b3ba5dd514395b7f8330cbc3ec1ae1f3c4e61a34eb0a5bd1133e3bb12325"
        }
      }
    },
    {
      "control_id": "options.effect",
      "gesture": "Drag",
      "window_action": "SetRange",
      "expected": "31-frame continuous drag reaches a clamped endpoint",
      "observed": "55.1327 -> 100 across 31 samples",
      "responsive": true,
      "matches_expected": true,
      "assertions": {
        "continuous": true,
        "monotonic": true,
        "endpoint_clamped": true
      },
      "frames": {
        "before": {
          "path": "07-options-effect-drag-before.png",
          "sha256": "54f1b3ba5dd514395b7f8330cbc3ec1ae1f3c4e61a34eb0a5bd1133e3bb12325"
        },
        "mid": {
          "path": "07-options-effect-drag-mid.png",
          "sha256": "da19d5aa9ee8625c9938db62b15fe35a34464edd8ab918b4a898259ec2949fcb"
        },
        "after": {
          "path": "07-options-effect-drag-after.png",
          "sha256": "d1aaf0cb36311883a5bbf5011aca95d916aeeace52dec8867c5423b443de8eef"
        }
      },
      "motion_samples": [
        55.1326769961124,
        56.6283011550538,
        58.1238669071471,
        59.6194326592404,
        61.1149984113337,
        62.610564163427,
        64.1061883223684,